{
  "tsa_version": "1.0.0",
  "id": "TSA-2025-0001",
  "published": "2025-07-09T00:00:00Z",
  "modified": "2025-07-09T18:00:00Z",
  "publisher": {
    "name": "MCP Security Working Group",
    "namespace": "https://github.com/mcp-security"
  },
  "title": "mcp-remote OS Command Injection via OAuth Callback URL",
  "description": "The mcp-remote package before version 0.1.16 is vulnerable to OS command injection through malicious OAuth callback URLs. When a user connects to a malicious MCP server, the server can inject arbitrary shell commands through the authorizationUrl parameter. These commands execute when the OAuth callback handler processes the URL, resulting in full remote code execution with the privileges of the user running the MCP client. This vulnerability was discovered by JFrog Security Research.",
  "severity": {
    "cvss_v3": {
      "vector": "CVSS:3.1/AV:N/AC:L/PR:N/UI:R/S:C/C:H/I:H/A:H",
      "score": 9.6
    },
    "qualitative": "CRITICAL"
  },
  "affected": [
    {
      "tool": {
        "name": "mcp-remote",
        "registry": "npm",
        "purl": "pkg:npm/mcp-remote"
      },
      "versions": {
        "introduced": "0.0.5",
        "fixed": "0.1.16",
        "affected_range": ">=0.0.5 <0.1.16"
      },
      "status": "AFFECTED",
      "impact_statement": "Remote code execution on the host machine. Attacker gains full access with user privileges.",
      "capabilities_abused": ["network:oauth", "process:exec"],
      "attack_context": {
        "requires_agent_execution": false,
        "requires_user_interaction": true,
        "requires_network_access": true,
        "attack_complexity": "LOW",
        "prerequisites": ["User must connect to attacker-controlled MCP server"]
      }
    }
  ],
  "references": [
    {
      "type": "CVE",
      "id": "CVE-2025-6514",
      "url": "https://nvd.nist.gov/vuln/detail/CVE-2025-6514"
    },
    {
      "type": "ADVISORY",
      "id": "GHSA-6xpm-ggf7-wc3p",
      "url": "https://github.com/advisories/GHSA-6xpm-ggf7-wc3p"
    },
    {
      "type": "FIX",
      "url": "https://www.npmjs.com/package/mcp-remote?activeTab=versions",
      "description": "Fixed version on npm"
    }
  ],
  "actions": [
    {
      "type": "BLOCK",
      "scope": "REGISTRY",
      "condition": ">=0.0.5 <0.1.16",
      "urgency": "IMMEDIATE",
      "message": "BLOCKED: Critical RCE vulnerability (CVE-2025-6514). Update to >=0.1.16 immediately."
    },
    {
      "type": "WARN",
      "scope": "HOST",
      "condition": ">=0.0.5 <0.1.16",
      "urgency": "IMMEDIATE",
      "message": "WARNING: This version of mcp-remote has a critical RCE vulnerability. Do not connect to untrusted MCP servers."
    },
    {
      "type": "UPDATE",
      "scope": "ALL",
      "urgency": "IMMEDIATE",
      "target_version": "0.1.16",
      "message": "Update to version 0.1.16 or later immediately."
    }
  ],
  "workarounds": [
    {
      "description": "Do not connect to untrusted or unknown MCP servers until updated.",
      "effectiveness": "PARTIAL",
      "instructions": "Only use mcp-remote with servers you control or explicitly trust."
    }
  ],
  "credits": [
    {
      "name": "JFrog Security Research",
      "organization": "JFrog",
      "type": "FINDER"
    }
  ]
}
